{
  "release_id": "parva-bs-public-demo",
  "release_type": "public_calendar",
  "status": "active",
  "calendar": "BS",
  "coverage": {
    "bs_year_start": 2078,
    "bs_year_end": 2083,
    "ad_date_start": "2021-04-14",
    "ad_date_end": "2026-04-14",
    "scope": "Public demo metadata, schemas, and conformance-safe historical examples only.",
    "future_values_included": false
  },
  "source_policy": "public_demo",
  "publication_status": "computed_prediction_not_official",
  "artifact_hashes": [
    {
      "artifact_id": "source-registry",
      "path": "data/public/releases/parva-bs-public-demo.sources.json",
      "sha256": "e6ea68e4f966db35e91abd546a7a3958a9ecdc1ce958b66a3bd521b909b4916d",
      "media_type": "application/json",
      "description": "Public-safe source registry for this demo release."
    },
    {
      "artifact_id": "release-manifest-schema",
      "path": "schemas/release-manifest.schema.json",
      "sha256": "b0730312118f859758a8a6c48499222c213c61c500bbde0d087e90d13237c68c",
      "media_type": "application/schema+json",
      "description": "JSON schema for public release manifests."
    },
    {
      "artifact_id": "source-registry-schema",
      "path": "schemas/source-registry.schema.json",
      "sha256": "36cc50513210a0ee3a48bed8bf87c219f569d7b07e626f0833f9462a22eabb6b",
      "media_type": "application/schema+json",
      "description": "JSON schema for public source registries."
    },
    {
      "artifact_id": "artifact-hash-schema",
      "path": "schemas/artifact-hash.schema.json",
      "sha256": "28bb0bd875b784f0e85d9e879e530725d6cb56cfe7302d9e3f5adacdb7347d89",
      "media_type": "application/schema+json",
      "description": "JSON schema for artifact hash entries."
    },
    {
      "artifact_id": "calculation-trace-schema",
      "path": "schemas/calculation-trace.schema.json",
      "sha256": "4caafb0abdede42711361f51ae462f0688e173495b75d26d725cf5e4984e82ad",
      "media_type": "application/schema+json",
      "description": "Existing public calculation trace schema used by this release layer."
    },
    {
      "artifact_id": "rulelang-rule-schema",
      "path": "schemas/rulelang-rule.schema.json",
      "sha256": "b1778d8b7ee3ec6006873306b2a161fe00240026392f782f1ac6b72724fa22f4",
      "media_type": "application/schema+json",
      "description": "JSON schema for public RuleLang rule definitions."
    },
    {
      "artifact_id": "impact-report-schema",
      "path": "schemas/impact-report.schema.json",
      "sha256": "1dd1c2728b668f1ebb33c41e4f7de19e0603d7009ad29099969a60cf3cb9d57a",
      "media_type": "application/schema+json",
      "description": "JSON schema for public temporal impact reports."
    },
    {
      "artifact_id": "agent-tool-schema",
      "path": "schemas/agent-tool.schema.json",
      "sha256": "cf74ada83f1dc336ae790b1e2e29dc189255c237adfaa9ce5a9e3f0fe595bda2",
      "media_type": "application/schema+json",
      "description": "JSON schema for public agent-safe temporal tool definitions."
    },
    {
      "artifact_id": "calendar-credential-schema",
      "path": "schemas/parva-protocol/calendar-credential.schema.json",
      "sha256": "08eeaf6498bf17337244fa5d6dae683931d75364f42d86e9706f5c42aa88db97",
      "media_type": "application/schema+json",
      "description": "JSON schema for Parva Protocol calendar credentials."
    },
    {
      "artifact_id": "conformance-report-schema",
      "path": "schemas/parva-protocol/conformance-report.schema.json",
      "sha256": "a6127221f85519bc082a5a53489b8bbe128c42b9b40f38864a9228a3048df0b8",
      "media_type": "application/schema+json",
      "description": "JSON schema for Parva Protocol conformance reports."
    },
    {
      "artifact_id": "offline-bundle-manifest-schema",
      "path": "schemas/parva-protocol/offline-bundle-manifest.schema.json",
      "sha256": "d9f86fa12a65e0b41e5c3dd0325912ea7612b6a8a2c178ac10d7bf3ff92d0165",
      "media_type": "application/schema+json",
      "description": "JSON schema for Parva Protocol offline bundle manifests."
    }
  ],
  "generated_at": "2026-05-13T00:00:00Z",
  "schemas_used": [
    "schemas/release-manifest.schema.json",
    "schemas/source-registry.schema.json",
    "schemas/artifact-hash.schema.json",
    "schemas/calculation-trace.schema.json",
    "schemas/rulelang-rule.schema.json",
    "schemas/impact-report.schema.json",
    "schemas/agent-tool.schema.json",
    "schemas/parva-protocol/calendar-credential.schema.json",
    "schemas/parva-protocol/conformance-report.schema.json",
    "schemas/parva-protocol/offline-bundle-manifest.schema.json"
  ],
  "capabilities": [
    "today",
    "ad_to_bs",
    "bs_to_ad",
    "month_calendar",
    "fiscal_year",
    "bs_month_metadata",
    "business_day_count",
    "compliance_profile_preview",
    "trust_source_registry",
    "trust_release_manifest",
    "trust_release_diff",
    "trust_log",
    "trust_evidence_packets",
    "timegraph_public_facts",
    "timegraph_fact_trace",
    "timegraph_conflict_fixture",
    "rulelang_public_registry",
    "rulelang_structured_validation",
    "rulelang_bounded_execution",
    "rulelang_evidence_packets",
    "impact_simulator_preview",
    "impact_change_set_simulation",
    "agent_safe_temporal_tools",
    "agent_temporal_claim_checker",
    "agent_schedule_planner",
    "parva_protocol_preview",
    "parva_protocol_conformance",
    "parva_protocol_credentials",
    "parva_protocol_offline_bundle_manifest"
  ],
  "default_confidence": "source_backed",
  "warnings": [
    "Public release metadata is not legal, tax, payroll, or banking-contract authority.",
    "Private source archives are not required for public verification and are not included here."
  ],
  "claim_boundary": {
    "official_publication_override": true,
    "future_outputs_status": "computed_prediction_not_official",
    "not_legal_or_banking_authority": true,
    "notes": "This public demo release describes verifiable metadata and safe examples. It is not an official government calendar publication."
  }
}
